{
  "schema": "triage-record/v1",
  "triage_id": "trg-cancel-01",
  "source_file": "msg/cancel.md",
  "triaged_at": "2026-09-29T10:00:00+07:00",
  "intent": "cancel",
  "category": "other",
  "priority": "normal",
  "target": "toolkit",
  "title": "Cancel old report colour change",
  "task": "Cancel REQ-0001; the requester no longer needs the report colour change.",
  "acceptance": [],
  "context_refs": [],
  "related_reqkit_id": "REQ-0001",
  "possible_duplicate_of": [],
  "needs_clarification": false,
  "questions": [],
  "flags": [],
  "confidence": "high"
}