{
  "schema": "triage-record/v1",
  "triage_id": "trg-two-tasks-02",
  "source_file": "msg/two-tasks.md",
  "triaged_at": "2026-09-29T10:00:00+07:00",
  "intent": "new",
  "category": "other",
  "priority": "normal",
  "target": "toolkit",
  "title": "Count pending 2b units in pipeline status",
  "task": "Make pipeline.sh status print how many 2b units are still pending.",
  "acceptance": [],
  "context_refs": [],
  "related_reqkit_id": null,
  "possible_duplicate_of": [],
  "needs_clarification": false,
  "questions": [],
  "flags": [],
  "confidence": "high"
}