{
  "schema": "triage-record/v1",
  "triage_id": "trg-ambiguous-01",
  "source_file": "msg/ambiguous.md",
  "triaged_at": "2026-09-29T10:00:00+07:00",
  "intent": "new",
  "category": "scan",
  "priority": "normal",
  "target": null,
  "title": "Re-run scan for payments service",
  "task": "Re-run the security scan for the payments service.",
  "acceptance": [],
  "context_refs": [],
  "related_reqkit_id": null,
  "possible_duplicate_of": [],
  "needs_clarification": true,
  "questions": [
    "Which plan or repository is the payments service (known targets: toolkit, <sys>/<plan>)?"
  ],
  "flags": [],
  "confidence": "low"
}