{
  "schema": "triage-record/v1",
  "triage_id": "trg-two-tasks-01",
  "source_file": "msg/two-tasks.md",
  "triaged_at": "2026-09-29T10:00:00+07:00",
  "intent": "new",
  "category": "other",
  "priority": "normal",
  "target": "toolkit",
  "title": "Show scan date in executive summary",
  "task": "Show the scan date next to the plan name in the executive summary.",
  "acceptance": [],
  "context_refs": [],
  "related_reqkit_id": null,
  "possible_duplicate_of": [],
  "needs_clarification": false,
  "questions": [],
  "flags": [],
  "confidence": "high"
}