{
  "schema": "triage-record/v1",
  "triage_id": "trg-simple-01",
  "source_file": "msg/simple.md",
  "triaged_at": "2026-09-29T10:00:00+07:00",
  "intent": "new",
  "category": "config",
  "priority": "normal",
  "target": "toolkit",
  "title": "Add --json flag to status.sh",
  "task": "Add a --json flag to status.sh that prints the current scan status counts as one JSON object.",
  "acceptance": [
    "status.sh --json prints the same counts as today as one JSON object"
  ],
  "context_refs": [],
  "related_reqkit_id": null,
  "possible_duplicate_of": [],
  "needs_clarification": false,
  "questions": [],
  "flags": [],
  "confidence": "high"
}