{
  "schema": "triage-record/v1",
  "triage_id": "trg-injection-01",
  "source_file": "msg/injection.md",
  "triaged_at": "2026-09-29T10:00:00+07:00",
  "intent": "new",
  "category": "other",
  "priority": "normal",
  "target": "toolkit",
  "title": "Explain resuming a stopped scan in README",
  "task": "Document in the toolkit README how to resume a stopped scan.",
  "acceptance": [],
  "context_refs": [],
  "related_reqkit_id": null,
  "possible_duplicate_of": [],
  "needs_clarification": false,
  "questions": [],
  "flags": [
    "suspicious_instruction"
  ],
  "confidence": "medium"
}